{
  "RecipeVersion": "1.0.0",
  "Kind": "survey",
  "Survey": {
    "Name": "GTPS",
    "Reference": "survey-gtps.json",
    "TaskName": "gtps"
  },
  "Scores": [
    {
      "Name": "Total",
      "Description": "Total score for Green et al. Paranoid Thought Scales (GPTS)",
      "Items": [
        "GTPS01",
        "GTPS02",
        "GTPS03",
        "GTPS04",
        "GTPS05",
        "GTPS06",
        "GTPS07",
        "GTPS08",
        "GTPS09",
        "GTPS10",
        "GTPS11",
        "GTPS12",
        "GTPS13",
        "GTPS14",
        "GTPS15",
        "GTPS16"
      ],
      "Method": "sum",
      "Range": {
        "min": 16,
        "max": 112
      }
    }
  ],
  "Psychometrics": {
    "Reliability": {
      "InternalConsistency": {
        "CronbachAlpha": null,
        "Note": "Add reliability data from validation studies"
      }
    },
    "Validity": {
      "Note": "Add validity evidence from original publication"
    }
  },
  "Usage": {
    "ScoringGuidelines": {
      "en": "Calculate total score by summing all items. Higher scores indicate higher levels of the measured construct.",
      "de": "Berechnen Sie den Gesamtscore durch Summierung aller Items. Höhere Werte bedeuten höhere Ausprägungen des gemessenen Konstrukts."
    },
    "InterpretationGuidelines": {
      "en": "Refer to original publication for interpretation guidelines and norms.",
      "de": "Siehe Originalpublikation für Interpretationsrichtlinien und Normen."
    }
  }
}