{
  "RecipeVersion": "1.0.0",
  "Kind": "survey",
  "Survey": {
    "Name": "REI",
    "Reference": "survey-rei.json",
    "TaskName": "rei"
  },
  "Scores": [
    {
      "Name": "Total",
      "Description": "Total score for Rational Experiental Inventory (REI)",
      "Items": [
        "REI01",
        "REI02",
        "REI03",
        "REI04",
        "REI05",
        "REI06",
        "REI07",
        "REI08",
        "REI09",
        "REI10"
      ],
      "Method": "sum",
      "Range": {
        "min": 10,
        "max": 70
      }
    }
  ],
  "Psychometrics": {
    "Reliability": {
      "InternalConsistency": {
        "CronbachAlpha": null,
        "Note": "Add reliability data from validation studies"
      }
    },
    "Validity": {
      "Note": "Add validity evidence from original publication"
    }
  },
  "Usage": {
    "ScoringGuidelines": {
      "en": "Calculate total score by summing all items. Higher scores indicate higher levels of the measured construct.",
      "de": "Berechnen Sie den Gesamtscore durch Summierung aller Items. Höhere Werte bedeuten höhere Ausprägungen des gemessenen Konstrukts."
    },
    "InterpretationGuidelines": {
      "en": "Refer to original publication for interpretation guidelines and norms.",
      "de": "Siehe Originalpublikation für Interpretationsrichtlinien und Normen."
    }
  }
}