{
  "RecipeVersion": "1.0.0",
  "Kind": "survey",
  "Survey": {
    "Name": "FS",
    "Reference": "survey-fs.json",
    "TaskName": "fs"
  },
  "Scores": [
    {
      "Name": "Total",
      "Description": "Total score for Flourishing Scale (FS)",
      "Items": [
        "FS01",
        "FS02",
        "FS03",
        "FS04",
        "FS05",
        "FS06",
        "FS07",
        "FS08"
      ],
      "Method": "sum",
      "Range": {
        "min": 8,
        "max": 56
      }
    }
  ],
  "Psychometrics": {
    "Reliability": {
      "InternalConsistency": {
        "CronbachAlpha": null,
        "Note": "Add reliability data from validation studies"
      }
    },
    "Validity": {
      "Note": "Add validity evidence from original publication"
    }
  },
  "Usage": {
    "ScoringGuidelines": {
      "en": "Calculate total score by summing all items. Higher scores indicate higher levels of the measured construct.",
      "de": "Berechnen Sie den Gesamtscore durch Summierung aller Items. Höhere Werte bedeuten höhere Ausprägungen des gemessenen Konstrukts."
    },
    "InterpretationGuidelines": {
      "en": "Refer to original publication for interpretation guidelines and norms.",
      "de": "Siehe Originalpublikation für Interpretationsrichtlinien und Normen."
    }
  }
}