{
  "RecipeVersion": "1.0.0",
  "Kind": "survey",
  "Survey": {
    "Name": "AGG-A",
    "Reference": "survey-agg-a.json",
    "TaskName": "agg-a"
  },
  "Scores": [
    {
      "Name": "Total",
      "Description": "Total score for Aggressive behavior scale (for adolescents)",
      "Items": [
        "AGG-A01",
        "AGG-A02",
        "AGG-A03",
        "AGG-A04",
        "AGG-A05",
        "AGG-A06",
        "AGG-A07",
        "AGG-A08",
        "AGG-A09",
        "AGG-A10",
        "AGG-A11"
      ],
      "Method": "sum",
      "Range": {
        "min": 11,
        "max": 77
      }
    }
  ],
  "Psychometrics": {
    "Reliability": {
      "InternalConsistency": {
        "CronbachAlpha": null,
        "Note": "Add reliability data from validation studies"
      }
    },
    "Validity": {
      "Note": "Add validity evidence from original publication"
    }
  },
  "Usage": {
    "ScoringGuidelines": {
      "en": "Calculate total score by summing all items. Higher scores indicate higher levels of the measured construct.",
      "de": "Berechnen Sie den Gesamtscore durch Summierung aller Items. Höhere Werte bedeuten höhere Ausprägungen des gemessenen Konstrukts."
    },
    "InterpretationGuidelines": {
      "en": "Refer to original publication for interpretation guidelines and norms.",
      "de": "Siehe Originalpublikation für Interpretationsrichtlinien und Normen."
    }
  }
}