{
  "RecipeVersion": "1.0.0",
  "Kind": "survey",
  "Survey": {
    "Name": "CCSS",
    "Reference": "survey-ccss.json",
    "TaskName": "ccss"
  },
  "Scores": [
    {
      "Name": "Total",
      "Description": "Total score for Cooperative/Competitive Strategy Scale (CCSS)",
      "Items": [
        "CCSS01",
        "CCSS02",
        "CCSS03",
        "CCSS04",
        "CCSS05",
        "CCSS06",
        "CCSS07",
        "CCSS08",
        "CCSS09",
        "CCSS10",
        "CCSS11",
        "CCSS12",
        "CCSS13",
        "CCSS14",
        "CCSS15",
        "CCSS16",
        "CCSS17",
        "CCSS18",
        "CCSS19"
      ],
      "Method": "sum",
      "Range": {
        "min": 19,
        "max": 133
      }
    }
  ],
  "Psychometrics": {
    "Reliability": {
      "InternalConsistency": {
        "CronbachAlpha": null,
        "Note": "Add reliability data from validation studies"
      }
    },
    "Validity": {
      "Note": "Add validity evidence from original publication"
    }
  },
  "Usage": {
    "ScoringGuidelines": {
      "en": "Calculate total score by summing all items. Higher scores indicate higher levels of the measured construct.",
      "de": "Berechnen Sie den Gesamtscore durch Summierung aller Items. Höhere Werte bedeuten höhere Ausprägungen des gemessenen Konstrukts."
    },
    "InterpretationGuidelines": {
      "en": "Refer to original publication for interpretation guidelines and norms.",
      "de": "Siehe Originalpublikation für Interpretationsrichtlinien und Normen."
    }
  }
}