{
  "RecipeVersion": "1.0.0",
  "Kind": "survey",
  "Survey": {
    "Name": "GRIT-S",
    "Reference": "survey-grit-s.json",
    "TaskName": "grit-s"
  },
  "Scores": [
    {
      "Name": "Total",
      "Description": "Total score for Short Grit Scale (Grit-S)",
      "Items": [
        "GRIT-S01",
        "GRIT-S02",
        "GRIT-S03",
        "GRIT-S04"
      ],
      "Method": "sum",
      "Range": {
        "min": 4,
        "max": 28
      }
    }
  ],
  "Psychometrics": {
    "Reliability": {
      "InternalConsistency": {
        "CronbachAlpha": null,
        "Note": "Add reliability data from validation studies"
      }
    },
    "Validity": {
      "Note": "Add validity evidence from original publication"
    }
  },
  "Usage": {
    "ScoringGuidelines": {
      "en": "Calculate total score by summing all items. Higher scores indicate higher levels of the measured construct.",
      "de": "Berechnen Sie den Gesamtscore durch Summierung aller Items. Höhere Werte bedeuten höhere Ausprägungen des gemessenen Konstrukts."
    },
    "InterpretationGuidelines": {
      "en": "Refer to original publication for interpretation guidelines and norms.",
      "de": "Siehe Originalpublikation für Interpretationsrichtlinien und Normen."
    }
  }
}