{
  "RecipeVersion": "1.0.0",
  "Kind": "survey",
  "Survey": {
    "Name": "GSQS",
    "Reference": "survey-gsqs.json",
    "TaskName": "gsqs"
  },
  "Scores": [
    {
      "Name": "Total",
      "Description": "Total score for Groningen Sleep Quality Questionnaire",
      "Items": [
        "GSQS01",
        "GSQS02",
        "GSQS03",
        "GSQS04",
        "GSQS05",
        "GSQS06",
        "GSQS07",
        "GSQS08",
        "GSQS09",
        "GSQS10",
        "GSQS11",
        "GSQS12"
      ],
      "Method": "sum",
      "Range": {
        "min": 12,
        "max": 84
      }
    }
  ],
  "Psychometrics": {
    "Reliability": {
      "InternalConsistency": {
        "CronbachAlpha": null,
        "Note": "Add reliability data from validation studies"
      }
    },
    "Validity": {
      "Note": "Add validity evidence from original publication"
    }
  },
  "Usage": {
    "ScoringGuidelines": {
      "en": "Calculate total score by summing all items. Higher scores indicate higher levels of the measured construct.",
      "de": "Berechnen Sie den Gesamtscore durch Summierung aller Items. Höhere Werte bedeuten höhere Ausprägungen des gemessenen Konstrukts."
    },
    "InterpretationGuidelines": {
      "en": "Refer to original publication for interpretation guidelines and norms.",
      "de": "Siehe Originalpublikation für Interpretationsrichtlinien und Normen."
    }
  }
}