{
  "RecipeVersion": "1.0.0",
  "Kind": "survey",
  "Survey": {
    "Name": "BES-ALT",
    "Reference": "survey-bes-alt.json",
    "TaskName": "bes-alt"
  },
  "Scores": [
    {
      "Name": "Total",
      "Description": "Total score for Belonging, engagement, and self-confidence in higher education (BES)",
      "Items": [
        "BES-ALT01",
        "BES-ALT02",
        "BES-ALT03",
        "BES-ALT04",
        "BES-ALT05",
        "BES-ALT06",
        "BES-ALT07",
        "BES-ALT08",
        "BES-ALT09",
        "BES-ALT10",
        "BES-ALT11",
        "BES-ALT12"
      ],
      "Method": "sum",
      "Range": {
        "min": 12,
        "max": 84
      }
    }
  ],
  "Psychometrics": {
    "Reliability": {
      "InternalConsistency": {
        "CronbachAlpha": null,
        "Note": "Add reliability data from validation studies"
      }
    },
    "Validity": {
      "Note": "Add validity evidence from original publication"
    }
  },
  "Usage": {
    "ScoringGuidelines": {
      "en": "Calculate total score by summing all items. Higher scores indicate higher levels of the measured construct.",
      "de": "Berechnen Sie den Gesamtscore durch Summierung aller Items. Höhere Werte bedeuten höhere Ausprägungen des gemessenen Konstrukts."
    },
    "InterpretationGuidelines": {
      "en": "Refer to original publication for interpretation guidelines and norms.",
      "de": "Siehe Originalpublikation für Interpretationsrichtlinien und Normen."
    }
  }
}