{
  "RecipeVersion": "1.0.0",
  "Kind": "survey",
  "Survey": {
    "Name": "OHQ",
    "Reference": "survey-ohq.json",
    "TaskName": "ohq"
  },
  "Scores": [
    {
      "Name": "Total",
      "Description": "Total score for Oxford Happiness Scale",
      "Items": [
        "OHQ01",
        "OHQ02",
        "OHQ03",
        "OHQ04",
        "OHQ05",
        "OHQ06",
        "OHQ07",
        "OHQ08",
        "OHQ09",
        "OHQ10",
        "OHQ11",
        "OHQ12",
        "OHQ13",
        "OHQ14",
        "OHQ15",
        "OHQ16",
        "OHQ17"
      ],
      "Method": "sum",
      "Range": {
        "min": 17,
        "max": 119
      }
    }
  ],
  "Psychometrics": {
    "Reliability": {
      "InternalConsistency": {
        "CronbachAlpha": null,
        "Note": "Add reliability data from validation studies"
      }
    },
    "Validity": {
      "Note": "Add validity evidence from original publication"
    }
  },
  "Usage": {
    "ScoringGuidelines": {
      "en": "Calculate total score by summing all items. Higher scores indicate higher levels of the measured construct.",
      "de": "Berechnen Sie den Gesamtscore durch Summierung aller Items. Höhere Werte bedeuten höhere Ausprägungen des gemessenen Konstrukts."
    },
    "InterpretationGuidelines": {
      "en": "Refer to original publication for interpretation guidelines and norms.",
      "de": "Siehe Originalpublikation für Interpretationsrichtlinien und Normen."
    }
  }
}